{
  "$schema": "https://json-schema.org/draft/2020-12/schema",
  "title": "Project Context Registry (SSOT)",
  "description": "Schema for project.registry.json and module interact/registry.json SSOT files. The derived docs/context/registry.json has its own schema (_schemas/registry.schema.json).",
  "type": "object",
  "additionalProperties": false,
  "required": [
    "version",
    "moduleId",
    "updatedAt",
    "artifacts"
  ],
  "properties": {
    "version": {
      "type": "integer",
      "const": 1
    },
    "moduleId": {
      "type": "string",
      "description": "Owner module id, or 'project' for project-level registry"
    },
    "updatedAt": {
      "type": "string",
      "description": "ISO 8601 timestamp"
    },
    "artifacts": {
      "type": "array",
      "items": {
        "type": "object",
        "additionalProperties": false,
        "required": [
          "artifactId",
          "type",
          "path",
          "mode"
        ],
        "properties": {
          "artifactId": {
            "type": "string",
            "description": "Unique artifact identifier within the module scope",
            "pattern": "^[a-z0-9][a-z0-9._-]{0,62}[a-z0-9]$"
          },
          "type": {
            "type": "string",
            "description": "Artifact type, e.g. openapi, db-schema, bpmn, adr, diagram, glossary"
          },
          "path": {
            "type": "string",
            "description": "Repo-relative path to the artifact file"
          },
          "mode": {
            "type": "string",
            "enum": [
              "contract",
              "generated"
            ],
            "description": "contract = authoritative file; generated = produced by a generator command"
          },
          "format": {
            "type": "string"
          },
          "tags": {
            "type": "array",
            "items": {
              "type": "string"
            }
          },
          "checksumSha256": {
            "type": "string",
            "pattern": "^[a-f0-9]{64}$"
          },
          "lastUpdated": {
            "type": "string",
            "description": "ISO 8601 timestamp"
          },
          "source": {
            "type": "object",
            "additionalProperties": false,
            "properties": {
              "kind": {
                "type": "string",
                "enum": [
                  "manual",
                  "command"
                ]
              },
              "command": {
                "type": "string"
              },
              "cwd": {
                "type": "string"
              },
              "notes": {
                "type": "string"
              }
            }
          }
        }
      }
    }
  }
}
