{
  "version": 1,
  "moduleId": "project",
  "updatedAt": "2026-01-22T00:00:00.000Z",
  "artifacts": [
    {
      "artifactId": "api-openapi",
      "type": "openapi",
      "path": "docs/context/api/openapi.yaml",
      "mode": "contract",
      "format": "openapi-3.1",
      "tags": [
        "api"
      ],
      "source": {
        "kind": "manual",
        "notes": "Edit the contract file; then run ctl-context touch."
      }
    },
    {
      "artifactId": "api-index",
      "type": "json",
      "path": "docs/context/api/api-index.json",
      "mode": "generated",
      "format": "api-index-v1",
      "tags": [
        "api",
        "index",
        "llm"
      ],
      "source": {
        "kind": "command",
        "notes": "node .ai/scripts/ctl-api-index.mjs generate --touch"
      }
    },
    {
      "artifactId": "glossary",
      "type": "json",
      "path": "docs/context/knowledge/glossary.json",
      "mode": "contract",
      "format": "glossary-v1",
      "tags": [
        "glossary",
        "llm"
      ],
      "source": {
        "kind": "manual",
        "notes": "Edit via ctl-context add-term/remove-term; then run ctl-context touch."
      }
    },
    {
      "artifactId": "architecture-principles",
      "type": "markdown",
      "path": "docs/context/knowledge/architecture-principles.md",
      "mode": "contract",
      "format": "architecture-principles-v1",
      "tags": [
        "architecture",
        "llm"
      ],
      "source": {
        "kind": "manual",
        "notes": "Edit the Markdown file directly; then run ctl-context touch."
      }
    },
    {
      "artifactId": "bpmn-example",
      "type": "bpmn",
      "path": "docs/context/process/example.bpmn",
      "mode": "contract",
      "format": "bpmn-2.0",
      "tags": [
        "bpmn",
        "process"
      ],
      "source": {
        "kind": "manual",
        "notes": "Replace with real processes or add more .bpmn files; then run ctl-context touch."
      }
    }
  ]
}
