{
  "version": 1,
  "moduleId": "project",
  "updatedAt": "2026-02-19T14:49:22.429Z",
  "artifacts": [
    {
      "artifactId": "api-openapi",
      "type": "openapi",
      "path": "docs/context/api/openapi.yaml",
      "mode": "contract",
      "format": "openapi-3.1",
      "tags": [
        "api"
      ],
      "checksumSha256": "b1f4259e1fdc755df4bcb248fe2a643137d25d305603f78ae81e9d5f73f46a36",
      "lastUpdated": "2026-02-19T09:14:11.275Z"
    },
    {
      "artifactId": "api-index",
      "type": "json",
      "path": "docs/context/api/api-index.json",
      "mode": "generated",
      "format": "api-index-v1",
      "tags": [
        "api",
        "index",
        "llm"
      ],
      "checksumSha256": "e71f35e8c6daaf64b91f4894e22fa463350bd6e42cd3b27efe8c2fa1578bf068",
      "lastUpdated": "2026-02-19T13:55:20.296Z"
    },
    {
      "artifactId": "glossary",
      "type": "json",
      "path": "docs/context/knowledge/glossary.json",
      "mode": "contract",
      "format": "glossary-v1",
      "tags": [
        "glossary",
        "llm"
      ],
      "source": {
        "kind": "manual",
        "notes": "Edit via ctl-context add-term/remove-term; then run ctl-context touch."
      },
      "checksumSha256": "d518e1b838c2fc08c229e7675066e66d0ea977043ed8eae6fe9b0eba1fd3f6d1",
      "lastUpdated": "2026-02-19T14:08:22.649Z"
    },
    {
      "artifactId": "architecture-principles",
      "type": "markdown",
      "path": "docs/context/knowledge/architecture-principles.md",
      "mode": "contract",
      "format": "architecture-principles-v1",
      "tags": [
        "architecture",
        "llm"
      ],
      "source": {
        "kind": "manual",
        "notes": "Edit the Markdown file directly; then run ctl-context touch."
      },
      "checksumSha256": "6cc617057c651f0bfbd1eb8e4b8e224c38d5b1bc1a302266bc5d0b0d3f120f9e",
      "lastUpdated": "2026-02-19T14:07:51.195Z"
    }
  ]
}
